RUT,NOMBRE,APELLIDO,RESERVADOS,ID,TITULO,AUTOR,ESTADO,ISBN,EDICION,FECHA
1,1,1,1,1,El Señor de los Anillos,J.R.R. Tolkien,true,978-84-450-7787-0,1ª Edición,10-12-2023
1,1,1,2,2,Cien años de soledad,Gabriel García Márquez,true,978-84-376-0194-4,1ª Edición,10-12-2023
2,2,2,1,3,1984,George Orwell,true,978-84-7509-237-4,2ª Edición,10-12-2023
2,2,2,2,4,Don Quijote de la Mancha,Miguel de Cervantes,true,978-84-376-0494-5,1ª Edición,10-12-2023
2,2,2,3,5,Harry Potter y la piedra filosofal,J.K. Rowling,true,978-84-9838-225-6,3ª Edición,10-12-2023
